"Key","Item Type","Publication Year","Author","Title","Publication Title","ISBN","ISSN","DOI","Url","Abstract Note","Date","Date Added","Date Modified","Access Date","Pages","Num Pages","Issue","Volume","Number Of Volumes","Journal Abbreviation","Short Title","Series","Series Number","Series Text","Series Title","Publisher","Place","Language","Rights","Type","Archive","Archive Location","Library Catalog","Call Number","Extra","Notes","File Attachments","Link Attachments","Manual Tags","Automatic Tags","Editor","Series Editor","Translator","Contributor","Attorney Agent","Book Author","Cast Member","Commenter","Composer","Cosponsor","Counsel","Interviewer","Producer","Recipient","Reviewed Author","Scriptwriter","Words By","Guest","Number","Edition","Running Time","Scale","Medium","Artwork Size","Filing Date","Application Number","Assignee","Issuing Authority","Country","Meeting Name","Conference Name","Court","References","Reporter","Legal Status","Priority Numbers","Programming Language","Version","System","Code","Code Number","Section","Session","Committee","History","Legislative Body"
"SBIR7LQP","journalArticle","2023","Asadi, Kavosh; Fakoor, Rasool; Sabach, Shoham","Resetting the Optimizer in Deep RL: An Empirical Study","Advances in Neural Information Processing Systems","","","","https://papers.nips.cc/paper_files/paper/2023/hash/e4bf5c3245fd92a4554a16af9803b757-Abstract-Conference.html","","2023-12-15","2024-03-10 17:28:59","2024-03-10 17:29:02","2024-03-10 17:28:59","72284-72324","","","36","","","Resetting the Optimizer in Deep RL","","","","","","","en","","","","","papers.nips.cc","","","","D:\ZoteroLib\Storage\科研\研究生\bandits优化\优化器\Asadi et al_2023_Resetting the Optimizer in Deep RL.pdf","","","/unread; ⛔ No DOI found","","","","","","","","","","","","","","","","","","","","","","","","","","","","","","","","","","","","","","","","","","","","","",""
"C25JVYV7","journalArticle","2023","Lange, Robert; Tang, Yujin; Tian, Yingtao","NeuroEvoBench: Benchmarking Evolutionary Optimizers for Deep Learning Applications","Advances in Neural Information Processing Systems","","","","https://papers.nips.cc/paper_files/paper/2023/hash/660ba7851661638c559df47743c69e40-Abstract-Datasets_and_Benchmarks.html","","2023-12-15","2024-03-10 17:29:16","2024-03-10 17:29:17","2024-03-10 17:29:16","32160-32172","","","36","","","NeuroEvoBench","","","","","","","en","","","","","papers.nips.cc","","","","D:\ZoteroLib\Storage\科研\研究生\bandits优化\优化器\Lange et al_2023_NeuroEvoBench.pdf","","","/unread; ⛔ No DOI found","","","","","","","","","","","","","","","","","","","","","","","","","","","","","","","","","","","","","","","","","","","","","",""
"E5J6XPJN","journalArticle","2023","Li, Bingrui; Chen, Jianfei; Zhu, Jun","Memory Efficient Optimizers with 4-bit States","Advances in Neural Information Processing Systems","","","","https://papers.nips.cc/paper_files/paper/2023/hash/3122aaa22b2fe83f9cead1a696f65ceb-Abstract-Conference.html","","2023-12-15","2024-03-10 17:29:29","2024-03-10 17:29:30","2024-03-10 17:29:29","15136-15171","","","36","","","","","","","","","","en","","","","","papers.nips.cc","","","","D:\ZoteroLib\Storage\科研\研究生\bandits优化\优化器\Li et al_2023_Memory Efficient Optimizers with 4-bit States.pdf","","","/unread; ⛔ No DOI found","","","","","","","","","","","","","","","","","","","","","","","","","","","","","","","","","","","","","","","","","","","","","",""
"BRDXSIBJ","journalArticle","2023","Mozaffari, Mohammad; Li, Sikan; Zhang, Zhao; Mehri Dehnavi, Maryam","MKOR: Momentum-Enabled Kronecker-Factor-Based Optimizer Using Rank-1 Updates","Advances in Neural Information Processing Systems","","","","https://papers.nips.cc/paper_files/paper/2023/hash/39bc6e3cbf5a1991d33dc10ebff9a9cf-Abstract-Conference.html","","2023-12-15","2024-03-10 17:29:40","2024-03-10 17:29:41","2024-03-10 17:29:40","17832-17853","","","36","","","MKOR","","","","","","","en","","","","","papers.nips.cc","","","","D:\ZoteroLib\Storage\科研\研究生\bandits优化\优化器\Mozaffari et al_2023_MKOR.pdf","","","/unread; ⛔ No DOI found","","","","","","","","","","","","","","","","","","","","","","","","","","","","","","","","","","","","","","","","","","","","","",""
"WR52S4XW","journalArticle","2023","Peng, Hanyang; Qin, Shuang; Yu, Yue; Wang, Jin; Wang, Hui; Li, Ge","Birder: Communication-Efficient 1-bit Adaptive Optimizer for Practical Distributed DNN Training","Advances in Neural Information Processing Systems","","","","https://papers.nips.cc/paper_files/paper/2023/hash/7c72fcd7b6bffc3864c7152ab5a2dd83-Abstract-Conference.html","","2023-12-15","2024-03-10 17:29:52","2024-03-10 17:29:53","2024-03-10 17:29:52","39529-39552","","","36","","","Birder","","","","","","","en","","","","","papers.nips.cc","","","","D:\ZoteroLib\Storage\科研\研究生\bandits优化\优化器\Peng et al_2023_Birder.pdf","","","/unread; ⛔ No DOI found","","","","","","","","","","","","","","","","","","","","","","","","","","","","","","","","","","","","","","","","","","","","","",""
"GKKQ37AM","journalArticle","2023","Sun, Siyuan; Gao, Hongyang","Meta-AdaM: An Meta-Learned Adaptive Optimizer with Momentum for Few-Shot Learning","Advances in Neural Information Processing Systems","","","","https://papers.nips.cc/paper_files/paper/2023/hash/ce26d21662c979d515164b416d4571fe-Abstract-Conference.html","","2023-12-15","2024-03-10 17:30:08","2024-03-10 17:30:09","2024-03-10 17:30:08","65441-65455","","","36","","","Meta-AdaM","","","","","","","en","","","","","papers.nips.cc","","","","D:\ZoteroLib\Storage\科研\研究生\bandits优化\优化器\Sun et al_2023_Meta-AdaM.pdf","","","/unread; ⛔ No DOI found","","","","","","","","","","","","","","","","","","","","","","","","","","","","","","","","","","","","","","","","","","","","","",""
"SBPLZC76","journalArticle","2023","Yue, Yun; Ye, Zhiling; Jiang, Jiadi; Liu, Yongchao; Zhang, Ke","AGD: an Auto-switchable Optimizer using Stepwise Gradient Difference for Preconditioning Matrix","Advances in Neural Information Processing Systems","","","","https://papers.nips.cc/paper_files/paper/2023/hash/8f9d459c19b59b5400ce396e0f8c23e0-Abstract-Conference.html","","2023-12-15","2024-03-10 17:30:27","2024-03-10 17:30:28","2024-03-10 17:30:27","45812-45832","","","36","","","AGD","","","","","","","en","","","","","papers.nips.cc","","","","D:\ZoteroLib\Storage\科研\研究生\bandits优化\优化器\Yue et al_2023_AGD.pdf","","","/unread; ⛔ No DOI found","","","","","","","","","","","","","","","","","","","","","","","","","","","","","","","","","","","","","","","","","","","","","",""
"ANEVMX6S","journalArticle","2023","Zhang, Jiangtao; Liu, Shunyu; Song, Jie; Zhu, Tongtian; Xu, Zhengqi; Song, Mingli","Lookaround Optimizer: $k$ steps around, 1 step average","Advances in Neural Information Processing Systems","","","","https://papers.nips.cc/paper_files/paper/2023/hash/5b4b967d4222d87fa5b28b6ec7144058-Abstract-Conference.html","","2023-12-15","2024-03-10 17:30:42","2024-03-10 17:30:43","2024-03-10 17:30:42","28678-28698","","","36","","","Lookaround Optimizer","","","","","","","en","","","","","papers.nips.cc","","","","D:\ZoteroLib\Storage\科研\研究生\bandits优化\优化器\Zhang et al_2023_Lookaround Optimizer.pdf","","","/unread; ⛔ No DOI found","","","","","","","","","","","","","","","","","","","","","","","","","","","","","","","","","","","","","","","","","","","","","",""